{
  "schema_version": "1.0",
  "study_id": "ceiling_pilot_01",
  "title": "Ceiling height pilot (2.4 m vs 3.2 m)",
  "hypothesis": "A higher ceiling increases perceived spaciousness and pleasantness.",
  "pair_id": "ceiling_height_study_01",
  "control_spec": {
    "spec_version": "1.0",
    "room_type": "dining_room",
    "seed": 160,
    "shell": {
      "width_m": 5.4,
      "length_m": 6.2,
      "ceiling_height_m": 2.4,
      "contour": "angular"
    },
    "surfaces": {
      "wall": { "material": "plaster" },
      "floor": { "material": "wood" },
      "ceiling": { "material": "plaster", "visible": true }
    },
    "openings": {
      "door": { "wall": "front", "position": 0.824074, "width_m": 1.0 },
      "windows": [
        { "wall": "left", "position": 0.314516, "width_m": 1.1, "sill_m": 0.9, "head_m": 2.05 },
        { "wall": "left", "position": 0.685484, "width_m": 1.1, "sill_m": 0.9, "head_m": 2.05 }
      ]
    },
    "lighting": {
      "preset": "neutral_daylight",
      "warmth": 0.789474,
      "intensity": 0.6
    },
    "furniture": [
      { "catalog_id": "dining_table_6", "placement": { "slot": "table_center" } },
      { "catalog_id": "dining_chair", "placement": { "slot": "chair_1" } },
      { "catalog_id": "dining_chair", "placement": { "slot": "chair_2" } },
      { "catalog_id": "dining_chair", "placement": { "slot": "chair_3" } },
      { "catalog_id": "dining_chair", "placement": { "slot": "chair_4" } },
      { "catalog_id": "dining_chair", "placement": { "slot": "chair_5" } },
      { "catalog_id": "dining_chair", "placement": { "slot": "chair_6" } },
      { "catalog_id": "sideboard", "placement": { "slot": "long_wall_back" } },
      { "catalog_id": "pendant_light", "placement": { "slot": "above_table" } }
    ],
    "experiment": {
      "condition": "control",
      "manipulated_variables": ["shell.ceiling_height_m"],
      "pair_id": "ceiling_height_study_01"
    },
    "provenance": {
      "generated_by": "preset",
      "execution_path": "live",
      "notes": "Bundled canonical fallback study."
    }
  },
  "treatment_spec": {
    "spec_version": "1.0",
    "room_type": "dining_room",
    "seed": 160,
    "shell": {
      "width_m": 5.4,
      "length_m": 6.2,
      "ceiling_height_m": 3.2,
      "contour": "angular"
    },
    "surfaces": {
      "wall": { "material": "plaster" },
      "floor": { "material": "wood" },
      "ceiling": { "material": "plaster", "visible": true }
    },
    "openings": {
      "door": { "wall": "front", "position": 0.824074, "width_m": 1.0 },
      "windows": [
        { "wall": "left", "position": 0.314516, "width_m": 1.1, "sill_m": 0.9, "head_m": 2.05 },
        { "wall": "left", "position": 0.685484, "width_m": 1.1, "sill_m": 0.9, "head_m": 2.05 }
      ]
    },
    "lighting": {
      "preset": "neutral_daylight",
      "warmth": 0.789474,
      "intensity": 0.6
    },
    "furniture": [
      { "catalog_id": "dining_table_6", "placement": { "slot": "table_center" } },
      { "catalog_id": "dining_chair", "placement": { "slot": "chair_1" } },
      { "catalog_id": "dining_chair", "placement": { "slot": "chair_2" } },
      { "catalog_id": "dining_chair", "placement": { "slot": "chair_3" } },
      { "catalog_id": "dining_chair", "placement": { "slot": "chair_4" } },
      { "catalog_id": "dining_chair", "placement": { "slot": "chair_5" } },
      { "catalog_id": "dining_chair", "placement": { "slot": "chair_6" } },
      { "catalog_id": "sideboard", "placement": { "slot": "long_wall_back" } },
      { "catalog_id": "pendant_light", "placement": { "slot": "above_table" } }
    ],
    "experiment": {
      "condition": "treatment",
      "manipulated_variables": ["shell.ceiling_height_m"],
      "pair_id": "ceiling_height_study_01"
    },
    "provenance": {
      "generated_by": "preset",
      "execution_path": "live",
      "notes": "Bundled canonical fallback study."
    }
  },
  "validation": {
    "ok": true,
    "diff": {
      "shell.ceiling_height_m": [2.4, 3.2]
    },
    "validated_at": "2026-07-15T12:00:00Z",
    "validator": "validate_pair.py"
  },
  "task": {
    "type": "rating",
    "config": {
      "prompt": "How pleasant does this room feel?",
      "scale_min": 1,
      "scale_max": 7,
      "trials": 4
    }
  },
  "modality": "desktop_3d",
  "counterbalance": {
    "order_strategy": "seeded_shuffle"
  },
  "status": "published",
  "created_by": "opus_runner",
  "created_at": "2026-07-15T12:00:00Z"
}
